keyword,createTime,url,author_id,video_id,author_nickname,author_unique_id,desc,shareCount,commentCount,playCount,diggCount,collectCount,thumnail_url
https://www.tiktok.com/@vtv24news,2025-11-05 12:37:18,https://www.tiktok.com/@6802456532350485506/video/7569111204208069895,6802456532350485506,7569111204208069895,VTV24,vtv24news,“Cậu vàng” Tam - Chú chó được quan tâm nhất mạng xã hội những ngày gần đây - “nói” gì khi lên sóng truyền hình quốc gia? 😆  #tiktoknews #vtvdigital #vtv24 #mrgold #tiemphocuaanhhai #game #cauvang,51200,27,2800000,174300,7102,https://p16-sign-sg.tiktokcdn.com/tos-alisg-p-0037/oIAli8BDkAEami2KQrHOGYAIYl4CXAAAriAPa~tplv-tiktokx-origin.image?dr=14575&x-expires=1764936000&x-signature=mRQ48v5zj8ZXtH%2F%2FxlY%2BwZYtypo%3D&t=4d5b0474&ps=13740610&shp=81f88b70&shcp=43f4a2f9&idc=sg1
https://www.tiktok.com/@vtv24news,2025-10-26 12:04:51,https://www.tiktok.com/@6802456532350485506/video/7565391989408042248,6802456532350485506,7565391989408042248,VTV24,vtv24news,"Bảo Khánh bước vào phần thi Về đích chỉ với 175 điểm, sau khi trả lời chính xác cả 3 câu hỏi của chương trình, em đã có được 245 điểm, vươn lên dẫn đầu đoàn leo núi. #vtv24 #vtvdigital #tiktoknews #olympia #olympia2025 ",14900,30,5800000,168700,6495,https://p9-sign-sg.tiktokcdn.com/tos-alisg-p-0037/oop1fNAjxIBRofFjAUNXgVg7edRnzFGw9GOGeL~tplv-tiktokx-origin.image?dr=14575&x-expires=1764936000&x-signature=YerueA88xEhWJG21w4lj4Aw0dfQ%3D&t=4d5b0474&ps=13740610&shp=81f88b70&shcp=43f4a2f9&idc=sg1
https://www.tiktok.com/@vtv24news,2025-10-16 20:57:47,https://www.tiktok.com/@6802456532350485506/video/7561818431192878352,6802456532350485506,7561818431192878352,VTV24,vtv24news,"Những miếng thịt trâu thải loại, chảy nước, nhợt nhạt, nhưng qua bàn tay “phù phép” của một số đối tượng lại biến thành thịt bò “thượng hạng”, xuất hiện trong bữa ăn của người tiêu dùng. #vtvdigitlal #tiktoknews #vtv24 #hanggia  #bowagyu #wagyu",84700,19,5800000,111800,7202,https://p16-sign-sg.tiktokcdn.com/tos-alisg-p-0037/okuAEGAFbIA5HWAAp7JwgNQfEqeeDfsJAbNjyh~tplv-tiktokx-origin.image?dr=14575&x-expires=1764936000&x-signature=XYwocUonbPZmLz6Y%2FVrnjMuUhcI%3D&t=4d5b0474&ps=13740610&shp=81f88b70&shcp=43f4a2f9&idc=sg1
https://www.tiktok.com/@vtv24news,2025-12-03 19:45:00,https://www.tiktok.com/@6802456532350485506/video/7579554343767182612,6802456532350485506,7579554343767182612,VTV24,vtv24news,"Hiện nay, ngành thuế đang tăng tốc triển khai chiến dịch 60 ngày cao điểm ""chuyển đổi mô hình từ thuế khoán sang kê khai đối với hộ kinh doanh"". Tuy nhiên, trong bối cảnh thời gian gấp rút, vẫn còn không ít vướng mắc đang chờ được tháo gỡ. #vtv24 #vtvdigital #tiktoknews #thue #kekhaithue",1,0,289,16,0,https://p16-sign-sg.tiktokcdn.com/tos-alisg-p-0037/oMCGiFGJLAzlvffDAWFsAK4Jk1OQgkAeAkf1JI~tplv-tiktokx-origin.image?dr=14575&x-expires=1764936000&x-signature=rjw%2Fq1aeADuFSW3%2BYHVjN96N8mc%3D&t=4d5b0474&ps=13740610&shp=81f88b70&shcp=43f4a2f9&idc=sg1
https://www.tiktok.com/@vtv24news,2025-12-03 19:00:00,https://www.tiktok.com/@6802456532350485506/video/7579554044952300820,6802456532350485506,7579554044952300820,VTV24,vtv24news,"Theo lực lượng công an, đối tượng cầm đầu đường dây đã thuê nhiều đối tượng tại nhiều tỉnh thành để quản lý, chia tách, tính tiền thắng- thua và sử dụng tài khoản ngân hàng để chuyển-nhận tiền cá độ. #vtv24 #vtvdigital #tiktoknews",139,5,98900,2023,35,https://p9-sign-sg.tiktokcdn.com/tos-alisg-p-0037/oEz0EU414BAn2uAEAei0BVpAACvgvC3LI5frvi~tplv-tiktokx-origin.image?dr=14575&x-expires=1764936000&x-signature=2vmgqVOWN5YWTUVq9Kz4Ijc%2BwJc%3D&t=4d5b0474&ps=13740610&shp=81f88b70&shcp=43f4a2f9&idc=sg1
https://www.tiktok.com/@vtv24news,2025-12-03 18:15:57,https://www.tiktok.com/@6802456532350485506/video/7579588857021189396,6802456532350485506,7579588857021189396,VTV24,vtv24news,"Cơ quan Cảnh sát điều tra Công an tỉnh Lạng Sơn đã ra Quyết định khởi tố bị can và Lệnh bắt bị can để tạm giam đối với Đoàn Văn Sáng (sinh năm 1968, trú tại phường Tam Thanh, tỉnh Lạng Sơn) về tội Giết người. #vtv24 #vtvdigital #tiktoknews #doanvansang #langson",9580,0,948200,28900,1259,https://p9-sign-sg.tiktokcdn.com/tos-alisg-p-0037/osvpOAseAAAiAVlngEFaMGpDDfmrgwBEBCCAwI~tplv-tiktokx-origin.image?dr=14575&x-expires=1764936000&x-signature=zIjbsu8csoclMb8umO%2FzMrePGmA%3D&t=4d5b0474&ps=13740610&shp=81f88b70&shcp=43f4a2f9&idc=sg1
https://www.tiktok.com/@vtv24news,2025-12-03 17:30:00,https://www.tiktok.com/@6802456532350485506/video/7579513707089136917,6802456532350485506,7579513707089136917,VTV24,vtv24news,"Mặc dù video clip “bốc đầu” sau đó đã bị xóa, nhưng bằng các biện pháp nghiệp vụ, Đội Cảnh sát giao thông đường bộ số 2 và Công an phường Cẩm Phả (Quảng Ninh) đã nhanh chóng xác minh và triệu tập 6 đối tượng có liên quan đến làm việc. #vtv24 #vtvdigital #tiktoknews",1852,71,270000,6717,166,https://p16-sign-sg.tiktokcdn.com/tos-alisg-p-0037/oM2XjAAoSFDef8UfEgXQA8MbEXAr3dAAhr8zo6~tplv-tiktokx-origin.image?dr=14575&x-expires=1764936000&x-signature=msQo7MrI7Zf%2BBC2tNQv9QBMXwvo%3D&t=4d5b0474&ps=13740610&shp=81f88b70&shcp=43f4a2f9&idc=sg1
https://www.tiktok.com/@vtv24news,2025-12-03 16:30:00,https://www.tiktok.com/@6802456532350485506/video/7579513522200038676,6802456532350485506,7579513522200038676,VTV24,vtv24news,"Chiếc ô tô con đang di chuyển lên dốc cầu Rạch Miễu thuộc địa phận phường Mỹ Tho, tỉnh Đồng Tháp thì bất ngờ bốc cháy dữ dội khiến giao thông ùn ứ kéo dài. #vtv24 #vtvdigital #SEAGames2025",52,8,66800,1187,24,https://p9-sign-sg.tiktokcdn.com/tos-alisg-p-0037/ocpApDvRwC0EeAiV8BDIN2FAALCUgAfAOu1Bi5~tplv-tiktokx-origin.image?dr=14575&x-expires=1764936000&x-signature=TD4ouJRP3bTHxFYcbqeQm8XumdA%3D&t=4d5b0474&ps=13740610&shp=81f88b70&shcp=43f4a2f9&idc=sg1
https://www.tiktok.com/@vtv24news,2025-12-03 15:30:00,https://www.tiktok.com/@6802456532350485506/video/7579513327647296788,6802456532350485506,7579513327647296788,VTV24,vtv24news,"Theo báo cáo của Tổng công ty Điện lực miền Nam, sự cố mất điện này là do một đơn vị xây dựng trong quá trình thi công đã vi phạm hành lang an toàn của tuyến cáp ngầm 110kV Hà Tiên – Phú Quốc (thuộc bờ biển Hà Tiên). #vtv24 #vtvdigital #tiktoknews",126,42,181100,3951,107,https://p16-sign-sg.tiktokcdn.com/tos-alisg-p-0037/og6FA8n8CflSWDAeQ5mYrrXMAQpESYAbcEXfgA~tplv-tiktokx-origin.image?dr=14575&x-expires=1764936000&x-signature=t9NhNBh21ey%2BUmjndYAGL0Qoi0E%3D&t=4d5b0474&ps=13740610&shp=81f88b70&shcp=43f4a2f9&idc=sg1
https://www.tiktok.com/@vtv24news,2025-12-03 14:45:00,https://www.tiktok.com/@6802456532350485506/video/7579513132461198613,6802456532350485506,7579513132461198613,VTV24,vtv24news,"Đợt mưa lũ vừa qua đã làm hệ thống thủy lợi trên địa bàn tỉnh Đắk Lắk bị thiệt hại nghiêm trọng, trong đó có nhiều công trình huyết mạch cũng bị hư hỏng #vtv24 #vtvdigital #tiktoknews",45,21,186700,2454,98,https://p16-sign-sg.tiktokcdn.com/tos-alisg-p-0037/oE2vbpDuEdi9AFRA1AUEAgB1c3ALCmDeCIvfV7~tplv-tiktokx-origin.image?dr=14575&x-expires=1764936000&x-signature=MVmUiI7xvFwoQcaU9lut9dAItug%3D&t=4d5b0474&ps=13740610&shp=81f88b70&shcp=43f4a2f9&idc=sg1
https://www.tiktok.com/@vtv24news,2025-12-03 14:00:00,https://www.tiktok.com/@6802456532350485506/video/7579512824225942805,6802456532350485506,7579512824225942805,VTV24,vtv24news,Sự chú ý của người hâm mộ bóng đá Việt Nam ngày hôm nay sẽ hướng về trận ra quân của đội tuyển U22 Việt Nam  gặp đội tuyển U22 Lào. Toàn đội đã hoàn tất những sự chuẩn bị cuối cùng cho trận đấu quan trọng này.  #SEAGames2025 #SEAGames33 #SportsOnTikTok,55,45,346300,4995,165,https://p16-sign-sg.tiktokcdn.com/tos-alisg-p-0037/oIpLA4e1IA9FCFiCExAvuBAoAVFrFpfaGgoDaE~tplv-tiktokx-origin.image?dr=14575&x-expires=1764936000&x-signature=Xr7%2Fa2T85XH3CnTXFeYSoK4V9vc%3D&t=4d5b0474&ps=13740610&shp=81f88b70&shcp=43f4a2f9&idc=sg1
https://www.tiktok.com/@vtv24news,2025-12-03 13:30:00,https://www.tiktok.com/@6802456532350485506/video/7579482095374978324,6802456532350485506,7579482095374978324,VTV24,vtv24news,"Vào lúc 16h hôm nay (3/12), tuyển U22 Việt Nam sẽ bắt đầu hành trình chinh phục HCV SEA Games 33 bằng trận đấu đầu tiên với đội tuyển Lào. 🇻🇳 🇻🇳 🇻🇳 #vtv #seagames #vtv24 #tiktoknews #vtvdigital ",12,10,49000,307,10,https://p16-sign-sg.tiktokcdn.com/tos-alisg-i-photomode-sg/88efd1847cf043e48aeaa6529047e770~tplv-photomode-image.jpeg?dr=14555&x-expires=1764936000&x-signature=sJ%2B9uQQFRqn3JiMyxhusdTLg3iU%3D&t=4d5b0474&ps=13740610&shp=81f88b70&shcp=9b759fb9&idc=sg1&ftpl=1
https://www.tiktok.com/@vtv24news,2025-12-03 13:00:00,https://www.tiktok.com/@6802456532350485506/video/7579474745377262869,6802456532350485506,7579474745377262869,VTV24,vtv24news,"Nhiều điểm bị sạt trượt nặng, giao thông bị chia cắt. Khó khăn là thế nhưng đường đến trường của gần 20 học sinh ở thôn Phong Thái và thôn Tư Thạnh, xã Tuy An Tây (tỉnh Đắk Lắk) lại không bị đứt gãy. #vtv24 #vtvdigital #tiktoknews #satlo #DakLak",8,7,60000,1056,16,https://p16-sign-sg.tiktokcdn.com/tos-alisg-p-0037/oUxOAv0ieHEPlAB0AKAIKtiikvA6x6BKABLBw4~tplv-tiktokx-origin.image?dr=14575&x-expires=1764936000&x-signature=vvtORW%2Btl5poWvJ%2BdKomcH8C7rc%3D&t=4d5b0474&ps=13740610&shp=81f88b70&shcp=43f4a2f9&idc=sg1
https://www.tiktok.com/@vtv24news,2025-12-03 12:30:00,https://www.tiktok.com/@6802456532350485506/video/7579479547012189458,6802456532350485506,7579479547012189458,VTV24,vtv24news,"Giới trẻ hôm nay đối mặt với nhiều rủi ro sức khỏe tiềm ẩn, trong đó có HPV- vi rút gây u nhú ở người. Hầu hết người có họat động tình dục đều có nguy cơ nhiễm HPV vào một thời điểm nào đó trong đời, bất kể nam nữ. Theo một nghiên cứu tại Hoa Kỳ giai đoạn 2003 – 2006, gần 50% các trường hợp nhiễm mới HPV xảy ra ở độ tuổi trung học cơ sở - trung học phổ thông - sinh viên (từ 15 – 24 tuổi). Dù đa số trường hợp nhiễm HPV có thể tự đào thải, nhiễm HPV dai dẳng có thể dẫn đến các bệnh lý, tiền ung thư, ung thư liên quan. Đáng lưu ý, một số tổn thương tiền ung thư, ung thư do HPV gây ra và các phẫu thuật điều trị các bệnh lý này có thể ảnh hưởng đến khả năng mang thai, duy trì thai kỳ ở nữ giới.  Chủ động dự phòng HPV là một trong những hành động góp phần giúp các bạn trẻ an tâm theo đuổi những ưu tiên khác trong cuộc sống mà không bị gián đoạn, vững bước cho tương lai. Nội dung này được phối hợp biên soạn bởi VTV, Trung tâm Truyền thông - Giáo dục Sức khỏe Trung ương, Bộ Y tế và MSD, kiểm nhận bởi Trung tâm Truyền thông - Giáo dục Sức khỏe Trung ương, Bộ Y tế và được lưu hành cho mục tiêu giáo dục.  Hãy tham vấn chuyên gia y tế.      #HPVVietnam #ViMotVietNamKhongGanhNangBoiHPV #PhongVeHPV #VTV",5320,354,1300000,21400,1253,https://p9-sign-sg.tiktokcdn.com/tos-alisg-p-0037/o8H1EpigA5Ke6DFvAABAIwl5KJ0wuBABA9iuP5~tplv-tiktokx-origin.image?dr=14575&x-expires=1764936000&x-signature=fuZH5kVAzrBikLYPGyfzXfVBdY8%3D&t=4d5b0474&ps=13740610&shp=81f88b70&shcp=43f4a2f9&idc=sg1
https://www.tiktok.com/@vtv24news,2025-12-03 12:00:00,https://www.tiktok.com/@6802456532350485506/video/7579467392279973140,6802456532350485506,7579467392279973140,VTV24,vtv24news,"Xe ô tô kinh doanh vận tải hành khách không phải lắp ghế an toàn cho trẻ em. Đây là 1 trong những điều chỉnh quan trọng trong dự thảo Luật Sửa đổi, bổ sung một số điều của 10 luật có liên quan đến an ninh, trật tự. #vtv24 #vtvdigital #tiktoknews #ghetreem #oto",2055,1936,732400,11800,499,https://p16-sign-sg.tiktokcdn.com/tos-alisg-p-0037/o8AB1WDoFAYqLrvIAVy7ACICajfEIpAfgp6CsE~tplv-tiktokx-origin.image?dr=14575&x-expires=1764936000&x-signature=shVGfoncaNXZq%2FN%2BYKoUgckOaxk%3D&t=4d5b0474&ps=13740610&shp=81f88b70&shcp=43f4a2f9&idc=sg1
https://www.tiktok.com/@vtv24news,2025-12-03 11:30:00,https://www.tiktok.com/@6802456532350485506/video/7579474236641774869,6802456532350485506,7579474236641774869,VTV24,vtv24news,Những đoàn xe tải chở vật liệu thường xuyên di chuyển với tần suất lớn trên tuyến đường tỉnh lộ 269B gây ảnh hưởng nghiêm trọng tới sinh hoạt và an toàn của hàng trăm hộ dân xã Phú Bình và Tân Thành (Thái Nguyên). #vtv24 #vtvdigital #tiktoknews #xetaitronglon #thainguyen,854,447,725800,15400,379,https://p9-sign-sg.tiktokcdn.com/tos-alisg-p-0037/ooIVOppA7FyaNTNvDBEQQLFAaAACfgfjEsCAC5~tplv-tiktokx-origin.image?dr=14575&x-expires=1764936000&x-signature=h2YX9PFMm2BLcSZSOtcZOfZf9hE%3D&t=4d5b0474&ps=13740610&shp=81f88b70&shcp=43f4a2f9&idc=sg1
https://www.tiktok.com/@vtv24news,2025-12-03 11:00:00,https://www.tiktok.com/@6802456532350485506/video/7579467156459425045,6802456532350485506,7579467156459425045,VTV24,vtv24news,Đất đá sạt lở từ ta luy dương tràn xuống mặt đường. Thời điểm xảy ra sạt lở có nhiều người dân và phương tiện đang lưu thông qua vị trí sạt lở. #vtv24 #vtvdigital #tiktoknews #satlo #deoSongPha,201,20,144900,2693,99,https://p16-sign-sg.tiktokcdn.com/tos-alisg-p-0037/oYrvKenN0EUABAgxrBliZAtiIHBAbYAKNwvtT2~tplv-tiktokx-origin.image?dr=14575&x-expires=1764936000&x-signature=Nerx3XqPe%2BWDfY5nbTUVzWu0EeI%3D&t=4d5b0474&ps=13740610&shp=81f88b70&shcp=43f4a2f9&idc=sg1
https://www.tiktok.com/@vtv24news,2025-12-03 10:22:35,https://www.tiktok.com/@6802456532350485506/video/7579466869669694740,6802456532350485506,7579466869669694740,VTV24,vtv24news,"Khối không khí lạnh ảnh hưởng đến nước ta đang di chuyển chậm hơn so với dự báo, hiện mới về gần tới biên giới phía Bắc. Đến ngày kia (5/12), thời tiết ở miền Bắc sẽ rét cả ngày và đêm. Còn tại Trung Bộ hôm nay (3/12) có mưa lớn diện rộng, Nam Bộ chiều tối có mưa giông. #vtv24 #vtvdigital #tiktoknews #dubaothoitiet #khongkhilanh",1730,176,856600,14400,533,https://p16-sign-sg.tiktokcdn.com/tos-alisg-p-0037/o8AIgEeAVzVEpArfvAJLA6PKlTZDCCF2UYaB4g~tplv-tiktokx-origin.image?dr=14575&x-expires=1764936000&x-signature=3DB%2BD20iIoZxV3p04%2BMYlOHgomA%3D&t=4d5b0474&ps=13740610&shp=81f88b70&shcp=43f4a2f9&idc=sg1
https://www.tiktok.com/@vtv24news,2025-12-03 09:00:00,https://www.tiktok.com/@6802456532350485506/video/7579266476377378055,6802456532350485506,7579266476377378055,VTV24,vtv24news,"Vài tuần gần đây, nhiều người tiêu dùng đã phải ngỡ ngàng khi đi chợ. Từ mớ rau muống, bó cải ngọt, cho đến củ hành, củ tỏi... giá đều tăng, thậm chí có loại tăng gấp đôi so với trước.#vtv24 #tiktok #vtv #giarau #giarauxanh #hanoi",227,114,169800,3434,49,https://p16-sign-sg.tiktokcdn.com/tos-alisg-p-0037/oYAEF9wqEW5CUDLCIuQDfBfVakAFAAvgAknpIy~tplv-tiktokx-origin.image?dr=14575&x-expires=1764936000&x-signature=SkAs%2BfGbO1pqLXdoM2p9RSvzWJM%3D&t=4d5b0474&ps=13740610&shp=81f88b70&shcp=43f4a2f9&idc=sg1
https://www.tiktok.com/@vtv24news,2025-12-03 08:00:00,https://www.tiktok.com/@6802456532350485506/video/7579266124236311815,6802456532350485506,7579266124236311815,VTV24,vtv24news,'Làm việc' - Từ được thủ tướng Nhật Bản Takaichi thường xuyên nhắc đến - đã trở thành 'Từ thông dụng nhất Nhật Bản năm 2025'. Từ này đã gợi lên cả phản ứng tích cực lẫn tiêu cực trong người dân Nhật Bản.#vtv24 #tiktok #vtv #nhatban #lamviec5phut,34,15,49900,1028,24,https://p9-sign-sg.tiktokcdn.com/tos-alisg-p-0037/oYIAiAAiwEAyAKAwNlBlksI3sr9sBfXBKl40mu~tplv-tiktokx-origin.image?dr=14575&x-expires=1764936000&x-signature=PKJcFueny%2FiKrGitSpHIqjCq9tk%3D&t=4d5b0474&ps=13740610&shp=81f88b70&shcp=43f4a2f9&idc=sg1
https://www.tiktok.com/@vtv24news,2025-12-03 07:00:00,https://www.tiktok.com/@6802456532350485506/video/7579242941558885650,6802456532350485506,7579242941558885650,VTV24,vtv24news,"Tại Nhật Bản, một con cá cam thượng hạng vừa được bán với mức giá kỷ lục, 4 triệu yên, tương đương gần 700 triệu đồng.#vtv24 #tiktok #vtv #cacam #nhatban",679,205,685100,11900,300,https://p16-sign-sg.tiktokcdn.com/tos-alisg-p-0037/oUjkAdFEuEIrLAopAEAQVw1FefBcDiCUBDwCgP~tplv-tiktokx-origin.image?dr=14575&x-expires=1764936000&x-signature=k9o6Ba0wG8Tj%2FifHrTVD3gxwv7c%3D&t=4d5b0474&ps=13740610&shp=81f88b70&shcp=43f4a2f9&idc=sg1
https://www.tiktok.com/@vtv24news,2025-12-02 22:00:00,https://www.tiktok.com/@6802456532350485506/video/7579265758941728018,6802456532350485506,7579265758941728018,VTV24,vtv24news,"Bộ Tài chính đề nghị điều chỉnh mức doanh thu không phải nộp thuế với hộ kinh doanh lên 500 triệu đồng/năm (thay cho đề xuất 200 triệu đồng/năm trước đó). Dự kiến sẽ có khoảng 2,3 triệu hộ kinh doanh không phải nộp thuế.#vtv24 #tiktok #vtv #thue #nopthue #thuedoanhnghiep #thuecanhan",607,232,347800,6537,397,https://p16-sign-sg.tiktokcdn.com/tos-alisg-p-0037/ospAEufCADEJqgAAb9mCfFg4YBU8CIjZVvLptA~tplv-tiktokx-origin.image?dr=14575&x-expires=1764936000&x-signature=kUyoYUzBgIonJOE8kZhPy%2FBNTWs%3D&t=4d5b0474&ps=13740610&shp=81f88b70&shcp=43f4a2f9&idc=sg1
https://www.tiktok.com/@vtv24news,2025-12-02 21:15:00,https://www.tiktok.com/@6802456532350485506/video/7579249577048493319,6802456532350485506,7579249577048493319,VTV24,vtv24news,"Theo dự thảo của Bộ Giáo dục và Đào tạo, từ học kỳ 2 tới, trí tuệ nhân tạo (A.I) sẽ được triển khai dạy thí điểm tại một số cơ sở giáo dục. Từ năm học sau sẽ đề xuất triển khai rộng rãi trong các trường phổ thông từ cấp Tiểu học theo từng giai đoạn.#vtv24 #tiktok #vtv #trituenhantao",2612,322,691300,10700,626,https://p9-sign-sg.tiktokcdn.com/tos-alisg-p-0037/oYYuba0Iv7wSiAIi0AB0nAYR2AlAuA5rlRA8E~tplv-tiktokx-origin.image?dr=14575&x-expires=1764936000&x-signature=w8piU0u6vXTaH31ZlqcaIEc3t1A%3D&t=4d5b0474&ps=13740610&shp=81f88b70&shcp=43f4a2f9&idc=sg1
https://www.tiktok.com/@vtv24news,2025-12-02 20:30:00,https://www.tiktok.com/@6802456532350485506/video/7579242649069047048,6802456532350485506,7579242649069047048,VTV24,vtv24news,"Hàng triệu người dùng tại Việt Nam vẫn đặt mật khẩu dễ đoán, trong đó các dãy số 123456, hoặc 123456789 chiếm áp đảo. Bạn có là một trong số đó?#vtv24 #tiktok #vtv #matkhau #123456",1461,283,1100000,15300,573,https://p16-sign-sg.tiktokcdn.com/tos-alisg-p-0037/owFagUfBUExGKt0BY4o2AlA3uBQAwiCAiAAAIw~tplv-tiktokx-origin.image?dr=14575&x-expires=1764936000&x-signature=N4tvGmH3ZDgdTgKyOX0EkkGOiUw%3D&t=4d5b0474&ps=13740610&shp=81f88b70&shcp=43f4a2f9&idc=sg1
https://www.tiktok.com/@vtv24news,2025-12-02 19:51:30,https://www.tiktok.com/@6802456532350485506/video/7579242403974974727,6802456532350485506,7579242403974974727,VTV24,vtv24news,"Đến đêm mai, nhiệt độ tiếp tục giảm thêm, Bắc Bộ chuyển rét, vùng núi có nơi dưới 12 độ C. Trong khi đó, Trung Bộ dự báo sắp có mưa lớn.#vtv24 #tiktok #vtv #thoitietmienbac #thoitietmientrung #muamientrung #khongkhilanh",3419,138,1100000,16800,530,https://p16-sign-sg.tiktokcdn.com/tos-alisg-p-0037/o0wzSAwAlE5OiBQAAAPXAIRulYvAaSgMR4i47~tplv-tiktokx-origin.image?dr=14575&x-expires=1764936000&x-signature=5XqE1hY3hXPxZzCcTqYnFnjQMo0%3D&t=4d5b0474&ps=13740610&shp=81f88b70&shcp=43f4a2f9&idc=sg1
https://www.tiktok.com/@vtv24news,2025-12-02 19:00:00,https://www.tiktok.com/@6802456532350485506/video/7579190473852554514,6802456532350485506,7579190473852554514,VTV24,vtv24news,Nếu bạn có lỡ để thất lạc vật dụng cá nhân trên các phương tiện giao thông công cộng hoặc taxi tại thủ đô London (Anh) thì Văn phòng lưu trữ đồ thất lạc tại đây là nơi mà bạn nên tìm đến.#VTV #vtvtiktok #vtv24 #khochuado,162,40,313000,5161,124,https://p16-sign-sg.tiktokcdn.com/tos-alisg-p-0037/osI8vAWJEGAeYIAuAkAAa4eXQJLYesuGsnVfNx~tplv-tiktokx-origin.image?dr=14575&x-expires=1764936000&x-signature=gm%2BaatY5udYO%2FVwRGZXYMIV5vFA%3D&t=4d5b0474&ps=13740610&shp=81f88b70&shcp=43f4a2f9&idc=sg1
https://www.tiktok.com/@vtv24news,2025-12-02 18:00:00,https://www.tiktok.com/@6802456532350485506/video/7579190255279017234,6802456532350485506,7579190255279017234,VTV24,vtv24news,Một số cá nhân bị nghi ngờ đã sử dụng vật liệu không có khả năng chống cháy để che phủ giàn giáo xung quanh các tòa nhà thuộc khu chung cư vừa xảy ra hỏa hoạn ở Hồng Kông (Trung Quốc). Đây là kết luận của Ủy ban Độc lập Chống Tham nhũng Hồng Kông.#VTV #vtvtiktok #vtv24 #cháy#chayhongkong#hongkong#Trungquoc,75,41,372100,4300,151,https://p16-sign-sg.tiktokcdn.com/tos-alisg-p-0037/owUEqsYAlia3BMitxPAnAIU6sQSAqlvtAAuhS~tplv-tiktokx-origin.image?dr=14575&x-expires=1764936000&x-signature=RfPKRwo9oRvy45leBcnMGVwIvME%3D&t=4d5b0474&ps=13740610&shp=81f88b70&shcp=43f4a2f9&idc=sg1
https://www.tiktok.com/@vtv24news,2025-12-02 17:00:00,https://www.tiktok.com/@6802456532350485506/video/7579159505003433234,6802456532350485506,7579159505003433234,VTV24,vtv24news,Số người thiệt mạng do lũ lụt ở châu Á đã lên tới 1.160 người. Biến đổi khí hậu đang tạo ra nhiều đợt mưa cực đoan và bão mạnh hơn ở phần lớn khu vực châu Á. #VTV #vtvtiktok #vtv24 #biendoikhihau #chaua #baolu,327,150,378800,7312,359,https://p16-sign-sg.tiktokcdn.com/tos-alisg-p-0037/oslAAIYwNKBV6AclPAAYAEa1lEu5LAniTQiSv~tplv-tiktokx-origin.image?dr=14575&x-expires=1764936000&x-signature=SmcBqiSZQjlBZTHhi71NFCAjyd4%3D&t=4d5b0474&ps=13740610&shp=81f88b70&shcp=43f4a2f9&idc=sg1
https://www.tiktok.com/@vtv24news,2025-12-02 16:27:34,https://www.tiktok.com/@6802456532350485506/video/7579189842945314056,6802456532350485506,7579189842945314056,VTV24,vtv24news,"Buổi lễ diễn ra hoành tráng, công phu với sự xuất hiện của các lực lượng vũ trang; các bộ, ban, ngành; các tổ chức, đoàn thể chính trị - xã hội. Đặc biệt màn trình diễn của không quân tạo điểm nhấn đặc sắc.#VTV #vtvtiktok #vtv24 #lao #lào #diễubinh #quockhanhlao",40,35,129700,3502,88,https://p16-sign-sg.tiktokcdn.com/tos-alisg-p-0037/oofEDAUDpCspGtMFEAAr6AEqCBzufLLgiVIQAC~tplv-tiktokx-origin.image?dr=14575&x-expires=1764936000&x-signature=CId6TujrJmyBVOoJtaJNNAVR1%2Bs%3D&t=4d5b0474&ps=13740610&shp=81f88b70&shcp=43f4a2f9&idc=sg1
https://www.tiktok.com/@vtv24news,2025-12-02 16:00:00,https://www.tiktok.com/@6802456532350485506/video/7579158958464716040,6802456532350485506,7579158958464716040,VTV24,vtv24news,"Theo Cục môi trường, chỉ số chất lượng không khí lúc 10h nay (2/12) tại Hà Nội vẫn ở mức xấu trong thang cảnh báo, ảnh hưởng tới sức khỏe của mọi lứa tuổi. Ngưỡng này đã duy trì liên tục cả ngày lẫn đêm, ít nhất là 2 ngày nay.#VTV #vtvtiktok #vtv24 #hanoi #chatluongkhongkhi #onhiemkhongkhi",359,54,186900,4150,108,https://p16-sign-sg.tiktokcdn.com/tos-alisg-p-0037/oQn0d9pqAAA3AKrywEiDllUBbfGiqL0igBBAuI~tplv-tiktokx-origin.image?dr=14575&x-expires=1764936000&x-signature=tg%2Bwzv33bKe7ahdkS%2BXmSaVBHXk%3D&t=4d5b0474&ps=13740610&shp=81f88b70&shcp=43f4a2f9&idc=sg1
https://www.tiktok.com/@vtv24news,2025-12-02 15:15:00,https://www.tiktok.com/@6802456532350485506/video/7579158463746477319,6802456532350485506,7579158463746477319,VTV24,vtv24news,"Từ 1/1/2026, các hộ kinh doanh sẽ chuyển từ nộp thuế khoán sang tự kê khai và tự nộp thuế theo doanh thu thực tế. Với hộ có doanh thu nhỏ hay lớn, cách tính sẽ khác nhau; đồng thời mỗi ngành nghề lại áp dụng một mức thuế suất riêng. Cách tính cụ thể sẽ như thế nào?#VTV #vtvtiktok #vtv24 #thuekinhdoanh #kethaithue",2981,402,1100000,19900,4526,https://p16-sign-sg.tiktokcdn.com/tos-alisg-p-0037/ooH5lailuYZxEAAaVQUYAqqAAAS6IGYAiBJSP~tplv-tiktokx-origin.image?dr=14575&x-expires=1764936000&x-signature=fwrnU7qHi%2BUXL38rCiF0A7OBaZ8%3D&t=4d5b0474&ps=13740610&shp=81f88b70&shcp=43f4a2f9&idc=sg1
https://www.tiktok.com/@vtv24news,2025-12-02 14:24:28,https://www.tiktok.com/@6802456532350485506/video/7579158113354403079,6802456532350485506,7579158113354403079,VTV24,vtv24news,"HĐND TP. Hà Nội đã thông qua nghị quyết về thực hiện vùng phát thải thấp. Theo đó, những chiếc xe máy xăng sẽ bị cấm theo khung giờ, thời điểm hoặc khu vực thuộc vành đai 1 từ ngày 1/7/2026. Nghị quyết này đang nhận được nhiều ý kiến từ người dân.#VTV #vtvtiktok #vtv24 #hanoi #Camxemay #vungphatthaithap",731,232,368700,6801,201,https://p16-sign-sg.tiktokcdn.com/tos-alisg-p-0037/ogC9AJbLFFBALCpAIpEDvefQQAwmgPYPBpdsSV~tplv-tiktokx-origin.image?dr=14575&x-expires=1764936000&x-signature=%2FbV7BvXueavyILrjtVYeBF5%2Fcwc%3D&t=4d5b0474&ps=13740610&shp=81f88b70&shcp=43f4a2f9&idc=sg1
